ID,Name,Type,Cost,Dietary,Location,Description,Duration
1,Mountain Trail,Hiking,150,Any,Black River Gorges,"A scenic mountain trail offering panoramic views.",4 hours
2,Beach Cleanup,Beach,0,Any,Flic en Flac,"Participate in a beach cleanup to support local ecosystems.",2 hours
3,Eco-Lodge Stay,Accommodation,120,Vegetarian,Le Morne,"Stay in an eco-friendly lodge with sustainable practices.",1 night
4,Bird Watching Tour,Bird Watching,180,Any,Casela Nature Park,"Discover rare species on a guided bird watching tour.",3 hours
5,Coral Reef Snorkeling,Snorkeling,110,Any,Blue Bay,"Explore vibrant coral reefs and marine life.",Half-day
